,name,ingredients,instructions,preparation_time,cooking_time,total_time,image_url,source
151,Couscous couscous, tous  1 1/2 à 2 tasses de couscous 1 1/2 à 2 tasses de poulet ou d'eau 3 cuillères à soupe de sel de beurre et de poivre noir fraîchement fissuré,"Placer le couscous dans un bol à mélanger en verre ou en céramique.Dans une casserole moyenne, porter à ébullition le bouillon de poulet ou le beurre.Verser sur le couscous et couvrir le bol à mélanger avec une pellicule plastique ou un papier d'aluminium.Réservez et laissez reposer 5 minutes.Les pelucher avec une fourchette, puis ajouter le beurre et le sel et le poivre, au goût, et réserver pendant que le beurre fond.Servir chaud avec du poulet marocain, si vous le souhaitez.",82,8,90,on est entrain de generer l image de cette recette ...,https://www.foodnetwork.com/recipes/couscous-recipe1-1950267
152,Tagine de bœuf Tagine de bœuf,"   1 cuillères à soupe de niveau Ras El Hanout Spices Mix * 1 Nivel Tyspoon Ground Cumin 1 Niveau Tyspoon Ground Cinnamon 1 Nivelpoon Ground Ginger 1 Nive1 oignon, pelé et finement haché un petit tas de coriandre fraîche (coriandre), feuil cueillies et traque réservées 1 (14 onces / 400 g) de pois chiches, drainés 1 (14 onces / 400 g)) Tomates hachées 3 1/2 tasses / 800 ml de bouillon de légumes, de préférence bio 1 petite courge (environ 1 3/4 livres / 800 g), désédée et coupée en morceaux de 2 pouces / 5 cm 3 1/2 onces / 100 Gpruneaux, pidés et grossièrement déchirés 2 cuillères à soupe d'amandes en flocons, grillées","Suggestion de service: couscous légèrement assaisonné.Pour faire frotter les épices: mélanger le Ras El Hanout, le cumin, la cannelle, le gingembre, le paprika, le sel et le poivre noir dans un petit bol.Mettez le bœuf dans un grand bol, massagez-le avec le frottement des épices, puis couvrez avec une pellicule plastique ou un fichier de cingl et mettez au réfrigérateur pendant quelques heures - assez d'une nuit.De cette façon, les épices pénètrent vraiment et savent la viande.Lorsque vous êtes prêt à cuire, chauffez une généreuse roule d'huile d'olive dans une casserole de type tagine ou de la cocotte et faites frire la viande à feu moyen pendant 5 minutes.Ajouter l'oignon haché et la coriandre (coriandre) traque et faire frire pendant 5 minutes supplémentaires.Coup dans les pois chiches et les tomates, puis versez 1 3/4 tasses / 400 ml de bouillon et remuer.Porter à ébullition, puis mettre le couvercle sur la casserole ou couvrir de papier d'aluminium et réduire à mijoter 1 1/2 heures.À ce stade, ajoutez votre courge, les pruneaux et le reste du stock.Remuez tout, puis remontez le couvercle sur la casserole et continuez à cuisiner pendant encore 1 1/2 heures.Gardez un œil dessus et ajoutez une touche d'eau si elle a l'air trop sèche.Une fois le temps écoulé, retirez le couvercle et vérifiez la cohérence.Si cela semble un peu trop coulant, mijoter 5 à 10 minutes de plus avec le couvercle.Le bœuf doit être vraiment tendre et s'écaillir maintenant, alors ayez un goût et assaisonner avec une pincée ou 2 de sel.Disperser la coriandre (coriandre) part sur le tagine avec les amandes grillées, puis prendre directement à la table avec un grand bol de couscous légèrement assaisonné et plonger.",61,81,142,on est entrain de generer l image de cette recette ...,https://www.foodnetwork.com/recipes/jamie-oliver/beef-tagine-2124477
153,Tagine d'agneau avec des pois chiches tagine d'agneau avec des pois chiches,"  2 cuillères à soupe de beurre non salé 3 livres de ragoût d'agneau désossé, coupé en cubes de 1 pouce 2 tasses d'oignons hachés 1/2 tasse d'oignons hachés 1 (19 onces) peuvent des pois chiches, drainés et légèrement rincés 1 tasse d'eau 1 cuillère à soupe d'ail hachée 1cuillère à café de gingembre moulu 3/4 cuillère à café de sel 1/2 cuillère à thé","Chauffer le beurre dans une grande casserole à couvercle épais à feu moyen-élevé jusqu'à ce qu'ils soient parfumés et dorés.Ajouter l'agneau en 2 lots et brun.Retirez dans une assiette et réservez.Ajouter les oignons et les oignons verts et cuire, en remuant souvent jusqu'à tendreté, 5 à 7 minutes.Incorporer les pois chiches, l'eau, l'ail, le gingembre, le sel, le poivre noir, la cannelle et le poivron rouge.Retournez l'agneau et tous les jus accumulés dans la poêle.Remuer doucement pour enrober.Porter le mélange à ébullition, puis réduire le feu de sorte que le liquide mijote.Couvrir étroitement et cuire, en remuant l'agneau une ou deux fois, pendant 35 à 45 minutes.Retirer du feu et incorporer le persil et le sel et le poivre au goût.",113,82,195,on est entrain de generer l image de cette recette ...,https://www.foodnetwork.com/recipes/lamb-tagine-with-chickpeas-recipe-1907321
154,Tagine de poulet avec des olives et citrons préservés Tagine de poulet avec des olives et des citrons conservés," tout le sel de roche 1 grand poulet entier, coupé en 8 morceaux 1 cuillère à soupe de vinaigre de vin bnc 5 cuillères à soupe d'huile d'olive 1 grand peloton de coriandre fraîche, hachée 1 cuillère à café de cannelle 1/2 cuillère à caféail, haché 1 cuillère à café de cumin 1 cuillère à café de gingembre moulu 1 cuillère à café de paprika 1 cuillère à café de girminage 1/4 livres, foie de poulet en option 1/4 livres, en option 1/4 tasse d'olives mixtes, 3 petits citrons conservés 1/4","Frottez d'abord le sel de roche dans les morceaux de poulet, puis lavez le poulet dans le vinaigre de vin blanc et l'eau.Partez pendant 10 minutes.Rincez et séchez et placez-le sur une assiette propre.Dans un grand bol, mélanger l'huile d'olive, la coriandre, la cannelle, le safran, le sel fin, 1/2 les oignons, l'ail, le cumin, le gingembre, le paprika, le curcuma.Mélanger tous ces ingrédients dans l'huile et écraser l'ail et ajouter un peu d'eau pour faire une pâte.Roulez les morceaux de poulet dans la marinade et laissez 10 à 15 minutes.Pour la cuisson, utilisez un étiquette (plat marocain traditionnel) ou un plat de casserole de fond profond et lourd.Faites chauffer le plat et ajoutez 2 cuillères à soupe d'huile d'olive au plat chaud.Déposez dans le poulet et versez sur l'excès de jus de marinade.Ajouter les oignons restants, les gésier, les foies de poulet, les olives et les citrons conservés hachés (pas de pulpe).Cuire au four moyen chaud (350 degrés F) pendant 45 minutes.Servir avec du pain frais.",11,62,73,on est entrain de generer l image de cette recette ...,https://www.foodnetwork.com/recipes/chicken-tagine-with-olives-and-preserved-lemons-recipe-1938959
155,Tagine de poulet avec chutney de tomate Tagine de poulet avec chutney de tomate,"Désélectionner tous  tomates Chutney: 5 tasses d'eau 4 tasse de tomates coupées hachées 1/2 tasse de vinaigre de vin rouge 1/2 tasse de sucre 2 cuillères à café râpé gingembre frais 1 cuillère à café de cayenne au poivron Rice basmati: 2 cuillères à soupe d'oignon finement haché 1 cuillère à soupe d'huile d'olive 1 tasse basmatiRice 1/4 cuillère à café de poivre noir 1/4 cuillère à café de curcuma 1 1/2 tasse de poulet bouillon de poulet poulet sali2 tasses bouillon de poulet 1 courgette, coupée en julienne bandes 1 poire","Pour le chutney, placez tous les ingrédients dans une casserole et portez à ébullition pendant environ 10 minutes.Ensuite, réduisez la chaleur et laissez mijoter jusqu'à ce que l'eau se soit complètement évaporée et que la sauce s'est épaissi en une consistance semblable à une confiture.Réserve.Pour le riz, faites sauter l'oignon dans l'huile d'olive pendant environ 5 minutes.Ajouter le riz, le poivre et le curcuma et remuer pour combiner.Ajouter le bouillon et le sel et porter à ébullition pendant 2 minutes.Réduire le feu à doux, couvrir étroitement et cuire pendant 20 à 25 minutes, ou jusqu'à ce que le riz soit al dente.Pour le poulet, faites sauter l'oignon dans l'huile d'olive jusqu'à ce qu'il soit translucide.Ajouter les lanières de poulet et faire sauter jusqu'à ce qu'elles soient presque dorées de tous les côtés.Ajouter le gingembre, la cannelle et le bouillon et porter à ébullition.Réduire le feu et laisser mijoter pendant 15 minutes.Ajouter les courgettes et les poireaux et cuire 5 minutes.Retirer du feu et assaisonner, au goût, avec du sel et du poivre.Servir le poulet et les légumes sur le riz.Garnir d'une cuillerée de chutney et de garnir de graines de carvi noire.",19,58,77,on est entrain de generer l image de cette recette ...,https://www.foodnetwork.com/recipes/chicken-tagine-with-tomato-chutney-recipe-1915146
156,Tagine de Lamb Stracotto avec oignons de printemps Tagine de Lamb Stracotto avec oignons de printemps," toute  marinade: 3 livres épaule d'agneau, coupée en cubes de 1 1/2 pouce 4 cuillères à soupe de feuil de romarin frais, fine hachée 15 gousses d'ail pelées, coussinets d'ail légèrement écrasés 6 cuillères à soupe d'extra virgin4 livres de pommes de terre en or au yukon (petites), coupé en deux 1 1/2 livres de carottes de taille moyenne pelées et coupées en morceaux de 1 pouce 1/4 tasse d'huile d'olive 1/2 tasse de farine tout-usure 1 1/2 tasse de vin rouge 71/2 tasse de bouillon de poulet (si vous utilisez en conserve, utilisez un faible sodium) 2 brins de romarin frais, environ 3 pouces de long 2 tasses oignons de printemps, racine et tige couchée 2 cuillères à soupe de feuil de persil italien, hachée fine 1 cuillère à soupe de zeste de citron et noir et noir moulupoivre","Préchauffer le four à 325 degrés F. Mélanger l'agneau avec le romarin, l'ail, l'huile et le vinaigre et laisser mariner au réfrigérateur pendant 1 heure.Pendant que l'agneau marine, blanchir les pommes de terre et les carottes.En eau bouillante bien salée, cuire les pommes de terre pendant 5 ou 6 minutes, puis transférer avec un skimmer dans un plateau ou un plateau.Cuire les carottes pendant 2 ou 3 minutes et réservez avec les pommes de terre.Chauffer l'huile d'olive dans une grande sauteuse à feu moyen-élevé jusqu'à ce que l'huile commence à fumer.Pendant que l'huile chauffait, retirer l'agneau de la marinade et assaisonner de sel et de poivre.Saupoudrez l'agneau avec la farine et mélanger pour enrober.Secouez l'excès de farine de la viande et ajoutez la moitié à la casserole en une seule couche afin de saisir la viande de tous les côtés, environ 2 minutes de chaque côté.Retirer dans une assiette.Répétez avec l'agneau restant.Placez soigneusement les pommes de terre et les carottes dans la casserole utilisée pour l'agneau.(L'huile d'olive aura beaucoup de saveur de l'agneau.) Assaisonner avec du sel et du poivre et faire revenir jusqu'à ce qu'il soit légèrement caramélisé, environ 4 minutes.Incorporer de temps en temps et réguler la chaleur afin que les légumes ne caramélisent pas trop d'un côté.Transférer dans un plateau ou une grande plaque afin qu'ils puissent être étalés en une seule couche.Versez et jetez l'huile résiduelle dans la casserole.Avec la casserole toujours à feu moyen, déglacez avec le vin et réduisez de moitié puis ajoutez le bouillon.Porter à mijoter et réduire à nouveau de moitié.Ajouter l'agneau poêlé dans la casserole et mélanger doucement pour incorporer avec la sauce à la casserole.Ajustez l'assaisonnement avec du sel et du poivre, au goût.Dans un four hollandais ou un grand plat de cuisson profonde, ajoutez le mélange d'agneau, de vin et de bouillon et de romarin.Couvrir puis placer dans le four préchauffé pendant 45 minutes.Ajouter les pommes de terre, les carottes et les oignons de printemps au ragoût.Mélanger soigneusement pour incorporer.Ajouter un peu de bouillon ou d'eau, si nécessaire, pour garder le ragoût humidifié.Continuez à cuire au four, couvert, jusqu'à ce que la viande et les légumes soient tendres, environ 10 minutes de plus.Incorporer le zeste de persil et de citron.Goûtez et ajoutez du sel et du poivre moulu frais si nécessaire.Servir directement à partir du plat de cuisson.",109,44,153,http:////food.fnr.sndimg.com/content/dam/images/food/fullset/2008/11/9/0/MO0607_Lamb-Stracotto.jpg.rend.hgtvcom.476.357.suffix/1383003498230.jpeg,https://www.foodnetwork.com/recipes/michael-chiarello/tagine-of-lamb-stracotto-with-spring-onions-recipe-2014423
157,Salade de carottes marocaines salade de carottes marocaines,"   carottes 1 1/2 livres 2 1/2 cuillères à soupe de jus de citron fraîchement pressé 2 1/2 cuillères à soupe d'huile d'olive extra-virgin 2 2 cuillères à soupe de raisins secs dorés (ou abricots séchés hachés) 1/2 curiander à  cuillèreCayenne grande pincée de cannelle casher salé haché à feuil ptes fraîches à feuil ptes, pour servir","Décollez les carottes et rasez-les dans des rubans avec un éplucheur de légumes.Mettez dans un grand bol.Ajouter le jus de citron, l'huile, les raisins secs, la coriandre, le cumin, le cayenne, la cannelle et 3/4 cuillère à café de sel et mélanger pour combiner.Transférer dans un plateau de service et saupoudrer de persil haché.",95,107,202,http:////food.fnr.sndimg.com/content/dam/images/food/fullset/2018/4/3/0/LS-Library_Moroccan-Carrot-Salad_s4x3.jpg.rend.hgtvcom.476.357.suffix/1522778515373.jpeg,https://www.foodnetwork.com/recipes/food-network-kitchen/moroccan-carrot-salad-5473930
158,Agneau du Colorado et couscous crostini Colorado Agneau et couscous crostini," tous  1/4 tasse de noix de pin 1/2 tasse de boeuf de bœuf 1 cuillère à soupe de beurre non salé 1/3 tasse de couscous 1 citron, zesté et jus 1 petite tomate, coupée en dés 1/4 pouce 2 cuillères à soupe de feuil de menthe fraîches hachées, et plus encorePour  garniture de 2 onces de fromage feta, émietté de 8 onces chorizo, retiré du boîtier et sauté jusqu'à ce qu'il soit fait 1 petit concombre sans pépins, peler, coupé en dés casserLonge, graisse et argent cutanée taillée 1/2 cuillère à café de cumin moulu 3 cuillères à soupe d'huile d'olive, plus pour faire griller 1/2 tasse de yogourt caisé crostini grillé","Faire chauffer le four à 375 degrés F. Placer les noix de pin sur une poêle et griller jusqu'à ce qu'ils soient dorés, de 3 à 5 minutes.Réservez et laissez le four allumé.Amener le bouillon de bœuf à mijoter dans une petite casserole.Ajouter le beurre et incorporer le couscous.Couvrir le pot et retirer du feu.Laisser reposer pendant 5 à 10 minutes.Péduir le couscous avec une fourchette et placer dans un bol moyen.Incorporer les noix de pin grillées, le zeste de citron et le jus, les tomates, 1 cuillère à soupe de menthe hachée, le chorizo, le fromage feta et tous sauf 3 cuillères à soupe du concombre.Ajouter le sel et le poivre au goût.Couvrir et réserver pour refroidir.Butterfly the Lon, allongez-vous dans la farce du couscous et liez avec de la ficelle de boucher.Dans un petit bol, mélanger le cumin, l'huile d'olive, le sel et le poivre, au goût.Badigeonner tous les côtés de la longe d'agneau avec l'huile aromatisée.Chauffer une casserole suffisamment grande pour tenir la longe, brosser d'huile.Placer la longe dans la poêle et cuire, en tournant jusqu'à ce qu'il soit à l'aspect de tous les côtés, environ 2 minutes de chaque côté.Transférer dans une poêle pour finir la cuisson au four, environ 5 minutes.Pendant ce temps, dans un petit bol en acier inoxydable, mélangez le yaourt avec la menthe et le concombre restants.Pour servir, coupez la longe d'agneau couscous et placez-vous sur des crostini grillés.Garnir de sauce au yaourt et de menthe fraîche.",53,32,85,on est entrain de generer l image de cette recette ...,https://www.foodnetwork.com/recipes/colorado-lamb-and-couscous-crostini-recipe-1940779
159,Paies de pâte feuilletée za'atar," tous  épices za'atar: 1 1/2 tasse de thym séché 3/4 tasses de sésame graines de sésame 1/4 tasse d'origan 1/4 tasse de sel casher 1/4 tasse de sumac séché (voir note de cuisinier) Pandes za'atar: all-Farine à but, pour épousseter une pâte feuilletée de 17,3 onces, décongelée et froide du réfrigérateur 1/4 tasse d'huile d'olive 1 bnc d'oeuf","Sur une surface farinée avec un rouleau à roulettes fariné, roulez une feuille de pâte feuilletée sur un carré de 16 pouces.Badigeonner avec de l'huile d'olive et saupoudrer d'environ 1 tasse de za'atar à travers la pâte pour couvrir principalement avec seulement de petites lacunes de pâte, brosser tout excès et laisser une bordure de 1/2 pouce de pâte propre sur les bords supérieur et inférieur.Pliez la pâte en deux vers vous, pinçant les bords nus pour sceller.Passez légèrement la pâte avec le rouleau à pâtisserie pour aider la pâte à rester ensemble.Répétez avec la pâte feuilletée restante.Ligne 2 plaques à pâtisserie avec papier parchemin et préchauffer le four à 400 degrés F. Battre le blanc d'oeuf avec 1 cuillère à soupe d'eau.Badigez-vous sur la surface de la pâte et saupoudrez chacun d'un za'atar de 1/3 tasse supplémentaire.À l'aide d'une roue à pizza ou d'un couteau très aiguisé, coupez chaque morceau de pâte en croix en 12 bandes.Tournez doucement chaque bande, puis allongez-vous sur la plaque à pâtisserie préparée en laissant au moins 2 pouces entre chacune et réfrigérez pendant au moins 15 minutes.(Enregistrez le Za'atar restant pour une autre utilisation.) Cuire les pailles réfrigérées, les positions rotatives et de commutation des casseroles à mi-chemin, jusqu'à ce qu'elles soient dorées, 10 à 15 minutes.Servir immédiatement ou refroidir à température ambiante.",40,24,64,http:////food.fnr.sndimg.com/content/dam/images/food/fullset/2016/11/3/1/FN_Allison-Robicelli-Zaatar-Puff-Pastry-Straws_s4x3.jpg.rend.hgtvcom.476.357.suffix/1478232034330.jpeg,https://www.foodnetwork.com/recipes/zaatar-puff-pastry-straws-3519592
160,Couscous vert couscous vert,"   1 cuillères à soupe d'huile d'olive extra-virginale 4 oignons verts, sel finement haché et poivre noir fraîchement moulu 1 1/2 tasse de poulet ou de légumes 1 sac à semelle à un thé vert 2 cuillères à soupe de miel 1 1/2 tasse de couscous 1/2 tasse finementfeuil de menthe hachées, quelques poignées 1/2 concombre sans pépins, pelées et hachées 1 citron, jus 1 citron vert, jus de jus","Chauffer l'huile d'olive dans la sauce à feu moyen et ajouter les oignons verts.Assaisonner avec du sel et du poivre et faire revenir de 2 à 3 minutes.Ajouter le bouillon et porter à ébullition, fixer un sachet de thé pour manipuler le pot et laisser tomber pendant 1 minute.Retirer le sachet de thé, incorporer le miel et le couscous.Éteignez le feu, incorporez la menthe et couvrez le pot.Laissez le couscous se tenir debout 5 minutes, puis peluchez de fourche et transférez dans un bol de service.Ajouter le concombre et le jus de citron et de citron vert.Assaisonner avec du sel et du poivre, pour goûter, mélanger pour combiner et servir.",79,84,163,on est entrain de generer l image de cette recette ...,https://www.foodnetwork.com/recipes/rachael-ray/green-tea-couscous-recipe-1947748
161,Salade de poivron rouge rôti salade de poivron rouge rôti," tous 1 citron 1 cuillère à café de cumin moulu 1/4 cuillère à café de gamin cannelle 1/2 cuillère à café de paprika 1/4 cuillère à café de poudre de chili, en option 1 à 2 cuillères à soupe d'olive à l'huile d'olive 2 (12-onces)pouces bandes le sel et le poivre noir fraîchement moulu 1 cuillère à soupe de feuil de persil frais finement hachées","Juice le citron sur un bol en verre de taille moyenne, jetant les graines.Ajouter le cumin, la cannelle, le paprika et la poudre de chili et fouetter l'huile d'olive.Mélanger les lanières de poivron rouge et assaisonner, au goût, avec du sel et du poivre.Ajouter le persil frais haché et servir à température ambiante.",31,3,34,http:////food.fnr.sndimg.com/content/dam/images/food/fullset/2007/11/21/0/GY0101_Roasted_Red_Pepper_Salad.jpg.rend.hgtvcom.476.357.suffix/1371585723751.jpeg,https://www.foodnetwork.com/recipes/roasted-red-pepper-salad-recipe1-1950232
162,Salade de carottes marocaines salade de carottes marocaines,sur Entrain de générer  ingrédients de cette reette ...,"Cuire 1 1/2 livres de carottes (tranchés finement sous un angle) dans de l'eau salée bouillante jusqu'à tendreté, de 3 à 5 minutes.Égoutter et tacher sécher.Dans un grand bol, fouetter 2 cuillères à soupe de jus de citron, 1 cuillère à soupe de harissa, 1 cuillère à café de miel et 1/4 cuillère à café de chaque cumin moulu et coriandre.Incorporer 3 cuillères à soupe d'huile d'olive.Ajouter les carottes et mélanger;Assaisonnez avec du sel et du poivre.Ajouter 1/2 tasse de coriandre hachée.",90,64,154,http:////food.fnr.sndimg.com/content/dam/images/food/fullset/2023/9/28/FNM110123_moroccan-carrot-salad_s4x3.jpg.rend.hgtvcom.476.357.suffix/1695924683278.jpeg,https://www.foodnetwork.com/recipes/food-network-kitchen/moroccan-carrot-salad-1-17886863
163,"Couscous avec des pois verts, de la menthe et du couscous de coriandre avec des pois verts, de la menthe et de la coriandre", tous  1 tasse de couscous 1/2 tasse de pois verts surgelé 1 cuillère à café de coriandre moulue 2 cuillères à soupe de menthe fraîche hachée,"Cuire le couscous en fonction des instructions de l'emballage, en ajoutant des pois et de la coriandre lorsque vous ajoutez du couscous à l'eau chaude.Lorsque vous êtes prêt à pelucher avec une fourchette, ajoutez la menthe et mélanger pour combiner.Assaisonner, au goût, avec du sel et du poivre noir.",41,92,133,on est entrain de generer l image de cette recette ...,https://www.foodnetwork.com/recipes/robin-miller/couscous-with-green-peas-mint-and-coriander-recipe-1917202
164,L'agnello Marocchino: Agneau marocain L'agnello Marocchino: Agneau marocain," tous  1 (5 1/2 livres) jambe d'agneau, désossé et coupé dans  cubes 5 cuillères à soupe d'huile d'olive 1 oignon, finement haché 1 cuillère à soupe de sucre 1 cuillère à café de cannelle moulue 1 cuillère à cafépruneaux séchés, piqués 2 cuillères à soupe de sésame graine de sésame","Dans un tagine chauffé (ou un pot avec un couvercle), chauffer l'huile d'olive et saisir l'agneau avec l'oignon pendant 2 minutes.Ajouter le sucre, la cannelle, le safran et le sel et le poivre à l'agneau.Laisser cuire encore une minute, en remuant de temps en temps.Ajouter le bouillon de légumes, couvrir et laisser cuire à feu doux à moyen pendant 45 minutes à 1 heure.Éteignez le feu, ajoutez les pruneaux et laissez reposer avec le couvercle pendant 5 minutes.Saupoudrer des graines de sésame avant de servir.",58,95,153,on est entrain de generer l image de cette recette ...,https://www.foodnetwork.com/recipes/lagnello-marocchino-moroccan-lamb-1959014
165,Morocain Thé à thé Granita Granita de thé marocain à la menthe marocaine,  6 cuillères à café de thé marocain ** (voir note de cuisinier) 1 1/2 cuillère à café d'orange d'eau de  fleur d'orange ** 3 grappes Fresh Mint 2 tasse de sucre 1/2 tasse de miel 4 quarts d'eau 2 gouttes,"Dans un grand pot, porter tous les ingrédients à ébullition, à l'exception du colorant alimentaire.Retirer du feu et laisser tomber pendant 10 minutes.Détressez et ajoutez la coloration.Gell avec un fouet en métal dans le mélange.Pendant la congélation, fouetter périodiquement pour ajouter de la folie et une texture granuleuse au granita",72,66,138,on est entrain de generer l image de cette recette ...,https://www.foodnetwork.com/recipes/moroccan-mint-tea-granita-recipe-1917305
166,Salade de poulet marocaine salade de poulet marocaine,"  2 petits panais, pelés et cantonnés dans le sens de  longueur 2 navets moyens, pelés et coupés en quartiers 1/4 tasse plus 2 cuillères à soupe d'huile d'olive extra vierge 2 cuillères à café1 15-once peut des pois chiches, drainés, rincés et séchés 2 tasses poulet rôti râpée, peau enlevée 1/2 tasse d'abricots séchés, 1/2 tasse d'olives à huile piquée 1/4 tasse d'amandes en tranches 1 paquet de 5-ocension bébé bébéMénge de roquettes (environ 8 tasses)","Préchauffer le gril.Mélanger les panais et les navets dans un grand bol avec 1 cuillère à soupe d'huile d'olive, 1 cuillère à café de ras el hanout, 1/4 cuillère à café de sel et quelques grinces de poivre.Étalez sur une plaque à pâtisserie et ajoutez les moitiés au citron coupées.Faire griller jusqu'à ce que les légumes soient légèrement dorés, environ 5 minutes.Mélanger les pois chiches dans le même grand bol avec 1 cuillère à soupe d'huile d'olive et les 1 cuillères à café restantes Ras El Hanout.Ajouter à la plaque à pâtisserie avec les autres légumes et remuer.Griller jusqu'à tendreté, environ 5 minutes.Laisser refroidir 5 minutes.Pressez le jus du citron grillé dans un grand bol.Ajouter 1/4 cuillère à café de sel et quelques mounts de poivre, puis incarner l'huile d'olive 1/4 tasse restante.Ajouter le poulet, les abricots séchés, les olives et les amandes et mélanger pour enrober.Ajouter les légumes grillés et les pois chiches et le mélange de ruisseau-spinach;lancer.",1,103,104,http:////food.fnr.sndimg.com/content/dam/images/food/fullset/2017/8/28/1/FNM100117_Moroccan-Chicken-Salad_s4x3.jpg.rend.hgtvcom.476.357.suffix/1503955173788.jpeg,https://www.foodnetwork.com/recipes/food-network-kitchen/moroccan-chicken-salad-3854724
167,Thé marocain à la menthe marocaine thé marocain,   tas de menthe fraîche quittent de l'eau bouilnte 2 cuillères à soupe.Garniture à  menthe à thé vert lâche dans  tasses à thé,Mettez les feuilles de menthe dans une théière d'eau bouillante.Versez du thé vert dans la passoire et ajoutez à l'eau bouillante.,63,81,144,on est entrain de generer l image de cette recette ...,https://www.foodnetwork.com/recipes/moroccan-mint-tea-recipe2-2129939
