,name,ingredients,instructions,preparation_time,cooking_time,total_time,image_url,source
97,Couscous à dates séchées couscous avec dates séchées,  1 tasse d'eau 1 tasse de poulet ou bouillon 1 cuillère à soupe d'huile d'olive 1/4 tasse de dates séchées finement hachées 1 tasse de couscous à cuisson rapide et de poivre noir fraîchement moulu,"Porter l'eau, le bouillon et l'huile à ébullition dans une petite casserole à feu moyen.Ajouter les dates suivies du couscous.Couvrir fermement la casserole avec un couvercle, retirer du feu et laisser reposer pendant 5 minutes.Peluchez avec une fourchette et assaisonnez de sel et de poivre, au goût.Transférer dans un bol de service et servir.",44,54,98,http:////food.fnr.sndimg.com/content/dam/images/food/fullset/2009/11/24/0/0132673_couscous-with-dates_s4x3.jpg.rend.hgtvcom.476.357.suffix/1388516640999.jpeg,https://www.foodnetwork.com/recipes/melissa-darabian/couscous-with-dried-dates-recipe-1948462
98,"Couscous avec cassis, amandes et couscous de persil avec groseilles, amandes et persil","   2 tasses de couscous instantanés 1/4 tasse de groseil 1/4 tasse d'amandes en tranches, 1/4 de persil pte à feuil ptes hachées et de poivre noir fraîchement moulu","Vérifiez les instructions du couscous pour voir de combien d'eau bouillante dont vous aurez besoin.Placer le couscous et les cassis dans un grand bol.Versez de l'eau bouillante sur le dessus, couvrez et laissez reposer 5 minutes.Retirer le couvercle, ajouter les amandes et le persil grillées et les peluches avec une fourche jusqu'à ce qu'ils soient combinés.Assaisonnez avec du sel et du poivre selon votre goût.Servez chaud ou à température ambiante.",66,82,148,http:////food.fnr.sndimg.com/content/dam/images/food/fullset/2006/9/15/0/sh0611_couscous_final.jpg.rend.hgtvcom.476.357.suffix/1385136927565.jpeg,https://www.foodnetwork.com/recipes/bobby-flay/couscous-with-currants-almonds-and-parsley-recipe-1946469
99,Citrons préservés salés des citrons préservés salés,   graines de fenouil de  cannelle Stick Graines de coriandre Perpperns Bay Leaf Sea Salt de gros citrons de graisses (de préférence sicilien avec  feuil toujours attachées),"Dans un bol, mélangez les épices dans le sel de mer.Coupez une croix dans les citrons - presque jusqu'à la base, mais pour que les quartiers restent ensemble.Poussez le sel assaisonné dans les segments de citron et emballez les citrons aussi étroitement que possible dans un pot hermétique.Moins il y a d'espace entre les citrons, plus il sera attrayant et vous n'aurez pas besoin d'utiliser autant de sel.Les citrons seront prêts après un mois de préservation et dureront environ 2 ans.Conseils: La peette est comestible, cela fonctionne également très bien avec les limes que vous pourriez également conserver des oranges comme celle-ci - mais il n'y a pas tellement de recettes qui les utilisent, vous devez utiliser le sel de mer et non le sel de table - le sel de table est trop chimique et des utilisations durs: Pour l'assaisonnement du riz et du couscous - il fonctionne comme du sel et fait du riz et du couscous parfumées au citron, mettez du poulet / du poisson dans un sac d'aluminium et cuire avec l'utilisation du sel de citron pour assaisonner des ragoûts et des soupes;",60,57,117,on est entrain de generer l image de cette recette ...,https://www.foodnetwork.com/recipes/jamie-oliver/salted-preserved-lemons-recipe-1955868
100,Couscous de poulet grillé avec abricots et couscous de poulet grillé à la pistache avec abricots et pistaches," tous le couscous: 1 cuillère à café de sel casher 1/4 cuillère à café de cumin 1/4 cuillère à café de poivron noir moulu-Lafeuille de chaux fraîchement râpée zeste de citronet  fosses enlevé l'huile de cano, pour brosser le sel casher et le poivre noir fraîchement moulu sel casher et le poivre noir fraîchement moulu","Pour le couscous: Mettez 1 1/2 tasse d'eau, le sel, le cumin et le poivre dans une petite casserole à feu vif et porter à ébullition.Incorporer le couscous, retirer du feu, couvrir et laisser reposer jusqu'à ce que l'eau soit absorbée et que le couscous soit tendre, environ 5 minutes.Transférer le couscous dans un bol, pelucher avec une fourchette et ajouter les pistaches, la menthe, le persil et le zeste de citron vert au goût.Mettre de côté.Pour le glaçage abricot-bassamique: Mettez le vinaigre dans une petite casserole et faites cuire à feu moyen-élevé jusqu'à ce qu'il soit réduit à 1/2 tasse.Incorporer la confiture d'abricot et laisser refroidir légèrement.Pour le poulet et les abricots: chauffer un charbon de bois ou un gril à gaz à haut pour les grillades directes.Badigeonner le poulet et les abricots d'huile et saupoudrer de sel et de poivre.Faire griller le poulet jusqu'à ce qu'il soit brun doré et légèrement carbonisé des deux côtés et juste cuit, environ 9 minutes au total.Laisser reposer 5 minutes avant de trancher.Faire griller les abricots coupés vers le bas jusqu'à ce qu'il soit brun doré et légèrement carbonisé;Retournez-vous et faites griller jusqu'à ce qu'il soit chauffé.Trancher en coins.Transférer le couscous dans une assiette et disposer le poulet et les abricots sur le dessus.Arroser du glaçage abricot-bassamique.",84,94,178,http:////food.fnr.sndimg.com/content/dam/images/food/fullset/2013/8/7/0/QF0309H_grilled-chicken-couscous-with-apricots-and-pistachio-recipe_s4x3.jpg.rend.hgtvcom.476.357.suffix/1377803651790.jpeg,https://www.foodnetwork.com/recipes/grilled-chicken-couscous-with-apricots-and-pistachio-2141389
101,Coupes d'agneau grillées avec des côtelettes d'agneau grillé de charme avec Charmoula,"   2 cuillères à café de sel 2 cuillères à café de casse au sol 1 cuillère à thé, tiges enlevées 2 gousses d'ail, hachée 1/2 tasse d'huile d'olive 1 citron, sel zesté et jus et poivre noir fraîchement moulu","Faire préchauffer le gril à feu moyen-élevé.Dans un petit bol, mélanger le sel, le cumin, le paprika et le Cayenne.Saupoudrer la moitié du mélange d'épices sur les côtelettes et laisser reposer à température ambiante pendant 30 minutes.Pour la Charmoula: dans un robot culinaire ou un mélangeur, ajoutez le mélange d'épices restant, les oignons, le persil, la coriandre, l'ail, l'huile d'olive, le zeste de citron et le jus.Mélanger jusqu'à consistance lisse et assaisonner de sel et de poivre, au goût.Mettre de côté.Badigeonner les côtelettes d'huile d'olive et mettre le gril.Faire griller jusqu'à ce que l'agneau soit moyen-rare, environ 4 à 6 minutes de chaque côté.Transférer les côtelettes dans un plateau de service et servir avec la Charmoula.",28,48,76,http:////food.fnr.sndimg.com/content/dam/images/food/video/0/01/013/0136/0136019.jpg.rend.hgtvcom.476.357.suffix/1660622353838.jpeg,https://www.foodnetwork.com/recipes/guy-fieri/grilled-lamb-chops-with-charmoula-recipe-1948592
102,"Coupez d'agneau grillé avec un anneau de courge musquée, couscous, asperges GRILL AGRILD CHOPS avec une bague de courge musquée, du couscous, des asperges"," tout pour l'agneau: 2 1/2 GRANDS RACKES D'HAEUX DOXIQUES 2 tasses d'huile d'olive 4 brins de romarin, à peu près hachés 6 gousses d'ail, pelées, à peu près hachées d'épices marocaines,  recette suit pour  anneaux de courge: 12 pièces bébé Squash Squash, Squash, Squash, Squash, Squash, recette pour  bagues: 12 pièces bébé Sunburst Squash,Couchons coupés 2 cuillères à soupe de beurre fondu 1 cuillère à soupe de miel 1 cuillère à soupe d'épices marocains Rub 1 cuillère à soupeLe couscous: 2 tasses Stock àThym frais 8 Frois de poivre noires entières","Pour l'agneau: coupez toutes les graisses des porte-greffes d'agneau et coupez chaque grille d'agneau en 4 morceaux.Mariner l'agneau dans l'huile d'olive, le romarin et l'ail pendant au moins 1 jour et jusqu'à 7 jours, réfrigéré.Retirer l'agneau de la marinade et retirer tout le romarin et l'ail en collant à la viande.Utilisez 1 cuillère à soupe de frottement d'épices pour enrober les racks.Faites griller les racks à feu vif pendant 3 minutes des deux côtés.À ce stade, l'agneau peut être fini dans un four de 400 degrés en environ 5 minutes pour les rares moyens.Pour les anneaux de courge: préchauffer le four à 350 degrés F. Peler la courge.En commençant par le haut de la courge coupé horizontalement à travers la courge à des intervalles de 1 pouce jusqu'à ce que vous ayez 4 pièces.À l'aide d'un coupe-cycle de pâtisserie, retirez à l'intérieur de chaque pièce afin d'avoir une bague.Placer les anneaux dans un plat de cuisson.Dans un bol, mélanger le beurre, le miel, 1 cuillère à soupe de frottement d'épices, le jus de citron et l'huile de citron.Versez sur les anneaux de courge.Couvrir avec du papier d'aluminium et cuire pendant environ 20 minutes ou jusqu'à ce que les anneaux soient doux.Pour les asperges: dans les asperges bouillonnantes de l'eau Blanch pendant environ 2 minutes ou jusqu'à Al dente.Choc dans un bain de glace.Utilisez la ciboulette comme chaîne pour lier les paquets de 5 asperges ensemble.Lorsqu'il est prêt à faire sauter les paquets de beurre jusqu'à ce qu'il soit réchauffé.Pour le couscous: dans un petit pot, apportez le bouillon de légumes, 1 cuillère à café d'huile d'olive, zeste de citron, 1 cuillère à café de sel et 1 cuillère à café de frottement d'épices à ébullition.Ajouter le couscous, remuer, couvrir et retirer du feu.Le couscous sera prêt dans environ 5 minutes.Pour la sauce au vin rouge: réduisez tous les ingrédients à une bonne consistance et passez à travers un chinois.Servir l'agneau avec les anneaux de courge, les asperges, le couscous et la sauce au vin rouge.Frotter les épices marocaines: Pour les épices marocaines, frottez: griandre la coriandre, cumin, fenouil et broyer dans un broyeur d'épices à une poudre et ajouter aux autres épices.Bien mélanger.",69,91,160,http:////food.fnr.sndimg.com/content/dam/images/food/fullset/2008/11/6/0/BH0108_Grilled-Lamb-Chops.jpg.rend.hgtvcom.476.357.suffix/1383002735530.jpeg,https://www.foodnetwork.com/recipes/grilled-lamb-chops-with-a-butternut-squash-ring-couscous-asparagus-recipe-2095601
103,Côtelettes d'agneau poêlé,"Désélectionner toute  sauce harissa: 2 poivrons de cloche rouge 1 cuillère à café de cumin graines de cumin 1 cuillère à soupe de coriandre graines de coriandre 1 cuillère à café de carme de voitures 1 gousseSade, recette suit l'huile d'olive extra-vierge 6 côtelettes d'agneau double, sade de blé blé de poivre noir fraîchement moulue de poivre noir fraîchement moulu: 2/2 tasse de blé boulgurtasse de figues séchées 1 cuillère à soupe de miel 1 cuillère à café de jus de citron 1/4 tasse d'eau chaude 1/2 tasse d'amandes fumées 1/2 tasse d'oignons verts hachés 1/2 tasse de coriandre hachée feuil 1/2 tasseLes feuil de menthe fraîche hachées 2 cuillères à soupe extra viergin viergin huile moulue au poivre noir du jus de citron, si nécessaire","Sur une flamme ouverte, placez 2 poivrons rouges.Laisser rôtir jusqu'à ce qu'il soit carbonisé.Envelopper dans une pellicule plastique et laisser s'asseoir pendant 10 minutes.Grattez la peau carbonisée des poivrons.Rassemblez le cumin, la coriandre et le carnaway dans une petite poêle et toast à feu doux jusqu'à ce qu'ils soient parfumés.Ensuite, broyez une poudre dans un moulin à épices ou un moulin à café propre.Mettez les poivrons dans un robot culinaire avec les épices, l'ail, les piments, le sel, l'huile d'olive et le jus de citron et le pouls en purée.Saupoudrer d'huile d'olive sur des côtelettes d'agneau des deux côtés et assaisonner de sel et de poivre.Mettez des côtelettes sur une casserole de gril préchauffée à feu moyen-élevé.Cuire 8 1/2 minutes de chaque côté pour les rares moyennes.Servir les côtelettes avec la Harissa et la salade de blé Bulgur.Garnir de coriandre.Salade de blé de boulgour: rendement: 4 à 6 portions toast Bulgur dans une casserole sèche à feu moyen-doux pendant 5 minutes et ajouter le jus de 1/2 citron.Dans un bol moyen, versez l'eau bouillante sur le boulgour.Incorporer 1/2 cuillère à café de sel.Couvrir d'un morceau de pellicule plastique et laisser reposer jusqu'à ce que le boulgour ait absorbé tout le liquide et est tendre, environ 15 à 20 minutes.Dans un petit bol, mélanger les figues, le miel, 1 cuillère à café de jus de citron et 1/4 tasse d'eau chaude et couvrir d'une pellicule plastique.Laisser reposer pendant 10 à 20 minutes.Peluchez le boulgour et remuer les figues et les amandes tendues.Ajouter les oignons verts hachés, la coriandre, le persil, la menthe et l'huile d'olive.Assaisonner de sel, de poivre et de jus de citron, au goût.Remuer pour combiner.",108,33,141,http:////food.fnr.sndimg.com/content/dam/images/food/fullset/2008/4/27/0/TU0508_Pan-Fried-Lamb-Chops-with-Harissa.jpg.rend.hgtvcom.476.357.suffix/1371585924589.jpeg,https://www.foodnetwork.com/recipes/pan-fried-lamb-chops-with-harissa-recipe-1910632
104,Couscous avec abricots couscous avec abricots," tous  1 1/2 tasse de couscous 2 tasses CHILLE BROCK 10 APPRICOTS SÉCHÉS, CHUP 2 SORGASfeuil, pour garnir","Mettez le couscous dans un bol moyen;Versez le bouillon chaud dessus et remuez pour combiner.Couvrir et laisser reposer 10 à 15 minutes.Découvrir et pelucher avec une fourchette.Ajouter les abricots, les oignons verts et le jus d'orange;Arroser d'huile d'olive et assaisonner de sel et de poivre.Mélanger doucement pour combiner.Garnir de persil haché.",117,23,140,http:////food.fnr.sndimg.com/content/dam/images/food/fullset/2004/6/24/0/fo1e03_couscous_apricots.jpg.rend.hgtvcom.476.357.suffix/1385517704711.jpeg,https://www.foodnetwork.com/recipes/tyler-florence/couscous-with-apricots-recipe-1942845
105,Poulet en briques avec couscous en brique poulet en brique avec couscous abricot,"  2 cuillères à soupe de cumin graine de cumin 2 cuillères à soupe de coriandre entière 2 bâtons de cannelle 1 cuillère à café de paprika sucré 1 cuillère à café de cayenne 1 cuillère à caféou avoir du poulet butter divisé pour vous) vinaigrette à l'huile d'olive extra vierge.Recette suit le couscous abricot,  recette suit  vinaigrette au yaourt de menthe: 1 1/2 tasse de yogourt nature 1/2 tashuile d'olive sel et poivre abricot couscous: extra viergin huile olive 1 petit oignon rouge, petits dés 1/4 tasse d'abricots séchés, hachés grossièrement hachés 1/4 tasse d'amandes entières grillées, grincheusement hachés 1 tasse de couscous 1 1/2 tasse de bouillon de poulet,chaud 1/2 cuillère à café de citron zeste 2 oignons verts parties vertes seulement 1/4 tasse de feuil de menthe fraîche, de feuil de coriandre fraîche à 1/2 tasse à peu près, à grossesses plus hachées pour garnir de sel casher et de poivre noir fraîchement moulu","Toast Cumin, coriandre et cannelle dans une casserole moyenne à feu doux jusqu'à ce qu'elles soient parfumées.Dans un moulin à épices propre ou un broyeur de café, mélanger les épices jusqu'à ce que ce soit bien.Ajouter les épices grillées dans un bol avec du paprika et de Cayenne.Assaisonner avec du sel casher.Incorporer l'huile d'olive et le jus de citron.Préparez le poulet en le divisant dans le dos et en retirant le squelette, l'os de la poitrine et la cage thoracique.Posez le poulet à plat et frottez les épices mélangées partout.Mariner jusqu'à 4 heures ou pendant la nuit.Préchauffer le four à 375 degrés F. Chauffer une grande poêle en fonte (ou une autre casserole à feuilles de four lourde) à feu moyen-élevé.Lorsqu'il est chaud, ajoutez un compte de 2 comptes d'huile d'olive extra vierge et placez le côté de la peau de poulet dans la poêle.Couvrez-le avec une deuxième casserole en fonte (vous pouvez également utiliser une brique plus traditionnelle enveloppée de papier d'aluminium) afin que la peau n'ait pas le temps de se contracter.Réduire le feu à moyen et cuire 10 à 15 minutes jusqu'à ce que le poulet soit doré et a une belle croûte.Terminez la cuisson au four pendant 20 à 25 minutes supplémentaires.La température interne entre la jambe et la cuisse doit enregistrer 165 degrés F sur un thermomètre à lecture instantanée, lorsqu'il est cuit.Servir avec une vinaigrette au yaourt à la menthe et un couscous abricot.Droit du yaourt à la menthe: Pendant que le poulet cuit, combinez le yaourt, la coriandre, la menthe, les oignons verts, le miel, le jus de citron, l'huile d'olive extra vierge et le sel et le poivre, au goût, dans un mélangeur.Mélanger jusqu'à ce que le mélange soit entièrement combiné et a une consistance lisse.Couscous abricot: rendement: 4 à 6 portions dans une casserole moyenne, ajoutez un nombre de 2 comptes d'huile d'olive extra vierge.Ajouter l'oignon rouge, les abricots et les amandes et faire revenir doucement à feu doux jusqu'à ce qu'ils soient translucides et légèrement parfumés.Ajouter le couscous puis vider dans le bouillon de poulet chaud.Remuer avec une fourche pour combiner, ajouter le zeste de citron et couvrir.Laisser reposer pendant 10 minutes, puis découvrir et ajouter les oignons verts, la menthe et la coriandre.Peluchez à nouveau avec une fourchette.Assaisonner, au goût, avec du sel et du poivre.Mélanger doucement pour combiner.Servir la famille sur un grand plateau et garnir de coriandre fraîche.",63,81,144,http:////food.fnr.sndimg.com/content/dam/images/food/fullset/2008/4/14/0/TU0501_Brick-Chicken-with-Apricot-Couscous.jpg.rend.hgtvcom.476.357.suffix/1371585595316.jpeg,https://www.foodnetwork.com/recipes/tyler-florence/brick-chicken-with-apricot-couscous-recipe-1910330
106,Longe d'agneau avec glaçure de datte épicée longe d'agneau avec glaçure de date épicée,"  2 cuillères à soupe d'huile de cano, plus plus pour le brossage 1 petit oignon espagnol, 2 gousses hachées de l'ail, hachée 3/4 tasse de bouillon de poulet à faible sodium 1/2 tasse de ketchup 2 cuillères à soupe de vinaigre de cidre de pomme 1/2 cuillère à café de gingembre 1/8cuillère à café de cayenne poudre 12 dates pites","Chauffer l'huile dans une casserole moyenne à feu moyen.Ajouter les oignons et cuire jusqu'à ce qu'il soit légèrement brun doré.Ajouter l'ail et cuire pendant 30 secondes.Ajouter le bouillon de poulet, 3/4 tasse d'eau, le ketchup, le vinaigre, le gingembre, le cayenne, les dattes, les clous de girofle, le bâton de cannelle et le miel pour goûter et cuire jusqu'à ce que les dattes soient très douces et que le mélange ait légèrement réduit.Transférer dans un mélangeur et mélanger jusqu'à consistance lisse.Ajouter la coriandre hachée et le sel et le poivre au goût et au pouls pour incorporer.Transférer dans un bol et laisser refroidir.Retirer 1/4 tasse pour la garniture.Faire chauffer un charbon de bois ou du gaz à moyen-élevé pour les grillades directes.Badigeonner l'agneau d'huile des deux côtés et saupoudrer de sel et de poivre.Faire griller, brosser avec le glaçage et tourner une ou deux fois, jusqu'à ce qu'il soit cuit à moyen-rare, environ 10 minutes au total.Retirer et laisser reposer avant de trancher.Placer les tranches d'agneau sur un plateau, arroser du glaçage réservé et garnir de feuilles de coriandre.",113,45,158,http:////food.fnr.sndimg.com/content/dam/images/food/fullset/2013/8/7/0/QF0309H_lamb-loin-with-spicy-date-glaze-recipe_s4x3.jpg.rend.hgtvcom.476.357.suffix/1377803651798.jpeg,https://www.foodnetwork.com/recipes/lamb-loin-with-spicy-date-glaze-2141391
107,Chili marocain et 10 000 grains de chili marocain et 10 000 grains de sable,"  2 cuillères à soupe d'huile d'olive extra-virginale 2 livres Salle d'agneau moulu et poivron noir fraîchement moulu 2 cuillères à soupe de chili poudre 1/2 cuillère à soupe de gamin Cumin 1 cuillère à soupe de coriander, haché 1 poivron vert, amené et haché 2 gousses d'ail, finement haché 1 citron, zesté et jus 2 cuillères à soupe de worcestershire sauce, globe ocuire 1 (14 onces) peut sauce tomate 2 cuillères à soupe de beurre 1/2 tasse de poulet une poignéeRaisins dorés 4 abricots, hachés 1 1/2 tasse de couscous 3 à 4 cuillères à soupe","Préchauffer le four à 400 degrés F. Chauffer la poêle avec de l'huile d'olive extra vierge, ajouter de la viande et du brun.Assaisonner la viande avec du sel et du poivre, au goût, de la poudre de chili, du cumin, de la coriandre, de la cannelle et du paprika.Ajouter la feuille de baie, les oignons, le poivron et l'ail dans la casserole.Cuire jusqu'à ce que les oignons soient doux, 8 minutes.Ajouter le jus de citron et le zeste, la sauce au worcestershire et la sauce tomate.Remuer et réduire le feu pour laisser mijoter.Porter le beurre et le bouillon à ébullition dans un pot avec un couvercle d'ajustement serré.Ajouter les fruits secs et le couscous, remuer puis éteindre le feu et mettre le couvercle en place.Laisser reposer 5 minutes.Ajouter les noix et les herbes et mélanger avec la fourchette.Toast pita coins dans le four chaud ou sous le gril.Empiler du piment dans des bols, garnir de ""sable"" et servir avec des coins pita pour la récupération.",79,14,93,http:////food.fnr.sndimg.com/content/dam/images/food/fullset/2007/10/1/0/TM1504_Morrocan_Chili_and_chips.jpg.rend.hgtvcom.476.357.suffix/1384957303561.jpeg,https://www.foodnetwork.com/recipes/rachael-ray/morrocan-chili-and-10000-grains-of-sand-recipe-1950447
108,"Artichaut, oignon et hachage de pomme de terre, hachage d'artichauts, d'oignon et de pomme de terre"," tout sel 8 pommes de terre à aîné moyen, coupé de moitié dans le sens de  longueur 3 cuillères à soupe d'huile d'olive 6 oignons cipollini, pelés, tranchés en deux le long des artichauts de bocal de l'équateur 1 (15 onces), (non mariné), avec des tiges, drainées, à peu près hachées fraîchement moulues pepper noir moulues noir moulues broye5 gousses à l'ail, banc de thyls brisés à 2 brins, feuil hachées 1/2 tasse de poulet 1 cuillère à soupe de cidre de pomme de vinaigre de persil haché feuil de persil, pour garniture","Porter un grand pot d'eau salée à ébullition à feu moyen.Ajouter les pommes de terre et cuire jusqu'à ce qu'elles soient tendres.Égoutter et tourner sur une planche à découper.Écrasez les pommes de terre avec le côté d'un grand couteau ou d'une spatule.Chauffer une grande poêle en fonte à feu moyen-élevé et ajouter l'huile d'olive.Lorsque la casserole est très chaude, mais pas de fumer, ajoutez les oignons cipollini et cuire jusqu'à commencer à caraméliser, environ 4 à 5 minutes ajoutez les artichauts drainés et assaisonnez avec du sel et du poivre, au goût.Cuire 2 à 3 minutes avant de les tourner pour qu'ils caramélisent.Ajouter les pommes de terre et cuire jusqu'à ce que les pommes de terre commencent à dorer, puis incorporer l'ail et le thym.Versez lentement le bouillon de poulet en grattant les bits du fond de la casserole.Saupoudrer de vinaigre et ajuster l'assaisonnement avec du sel et du poivre, si nécessaire.Transférer dans un plateau et garnir de persil haché.",104,78,182,on est entrain de generer l image de cette recette ...,https://www.foodnetwork.com/recipes/guy-fieri/artichoke-onion-and-potato-hash-recipe-1948725
109,"Pistache, couscous à l'ail et à la menthe, couscous de l'ail et de la menthe",   noix de pistache en décor,"Toast les noix dans une casserole adaptée au riz.Retirer dans un robot culinaire et hacher finement.Réserve.Ajouter l'évoo et l'ail dans le pot et remuer 1 à 2 minutes.Ajouter le stock et porter à ébullition.Incorporer le couscous, couvrir le pot, éteindre le feu et laisser reposer 5 minutes.Pendant ce temps, le pulls-poussia la menthe dans le robot culinaire très fin.Incorporer la menthe et les noix de moulues réservées dans le couscous pendant que vous peluchez avec une fourchette.",23,58,81,http:////food.fnr.sndimg.com/content/dam/images/food/fullset/2011/6/27/0/TM2521_pistachio-garlic-and-mint-couscous_s4x3.jpg.rend.hgtvcom.476.357.suffix/1371597546240.jpeg,https://www.foodnetwork.com/recipes/rachael-ray/pistachio-garlic-and-mint-couscous-recipe-1924988
