,name,ingredients,instructions,preparation_time,cooking_time,total_time,image_url,source
139," Turmeric and Cumin Chicken with Chiles, Cinnamon Oranges and Olive-Chickpea Couscous Turmeric and Cumin Chicken with Chiles, Cinnamon Oranges and Olive-Chickpea Couscous ","Deselect All 1 whole chicken, cut up (remove the skin from the legs and breasts, and reserve the wings) Kosher salt 1 lime 2 oranges 3 cloves garlic, finely chopped Sea salt 3 tablespoons EVOO 1 rounded tablespoon turmeric 1 1/2 teaspoons cumin seeds (half a palmful) 4 small fresh bay leaves Two 3-inch cinnamon sticks 2 serrano or jalapeno peppers, halved lengthwise 1 cup cracked green olives or olive mix 2 tablespoons butter One 14-ounce can chickpeas, drained and rinsed Handful of fresh cilantro or parsley leaves, finely chopped 1 1/2 cups couscous","Put the chicken wings in a small pot. Cover with water and sprinkle with salt. Simmer gently for 30 minutes. Meanwhile, combine the remaining chicken pieces with the juice of the lime, the juice of 1 orange and half the garlic. Sprinkle liberally with sea salt and toss to coat. Cover and marinate at room temperature for at least 45 minutes and up to 1 hour. Heat the EVOO in a large skillet over medium-high heat. Add the turmeric and cumin seeds and stir for a minute to toast the spices. Add the bay leaves, cinnamon sticks and chile peppers, and cook for a minute or 2 more. Add the chicken and turn to coat it with the spiced oil, then cook until the chicken is lightly browned, about 10 minutes. Slice the remaining orange and add it to the pan along with the olives. Cook until heated through. Remove the chicken wings from the poaching liquid, and add 1 cup of the liquid to the pan. Partially cover and simmer for 20 more minutes. Remove the cinnamon sticks. (If you aren't serving the chicken immediately, cool and then store it in the refrigerator. Store any leftover poaching liquid separately. Reheat the chicken over medium heat and prepare the couscous before serving.) Combine 1 1/2 cups reserved poaching liquid, the butter, chickpeas and cilantro in a large saucepan. Bring to a boil, and then stir in the couscous. Turn off the heat, cover the pan and let stand for 5 minutes. Fluff with fork. Serve the couscous with the chicken.",2,7,9,http:////food.fnr.sndimg.com/content/dam/images/food/fullset/2012/8/29/1/CCWID201_Turmeric-and-Cumin-Chicken-with-Chiles_s4x3.jpg.rend.hgtvcom.476.357.suffix/1371609750636.jpeg,https://www.foodnetwork.com/recipes/rachael-ray/turmeric-and-cumin-chicken-with-chiles-cinnamon-oranges-and-olive-chickpea-couscous-recipe-2201023
140, Puff Pastries with Raspberries and Orange Sabayon Puff Pastries with Raspberries and Orange Sabayon ,"Deselect All Puff Pastry Squares:  1 sheet frozen puff pastry (about 12 ounces), thawed Nonstick cooking spray 1/4 cup heavy cream Orange Sabayon: 3 tablespoons sugar 8 egg yolks 1 tablespoon orange juice 1 teaspoon lemon juice 1/2 teaspoon orange zest 1/4 teaspoon lemon zest 2 tablespoons orange liqueur, such as Grand Marnier 2 cups fresh raspberries 1/4 cup orange blossom honey 2 tablespoons confectioners' sugar","For the puff pastry squares: Preheat the oven to 400 degrees F. Carefully unfold the puff pastry and cut out twelve 3-by-3-inch squares. Line a half sheet tray with a nonstick silicon mat or spray with nonstick spray. Spread the squares out evenly on the half sheet tray, and lightly brush with the cream. Bake in the oven until golden and puffy, 10 to 15 minutes. Transfer the puffs to a wire rack to cool. For the orange sabayon: Combine the sugar and egg yolks in a large metal mixing bowl. Set the bowl over a pot of simmering water (to create a double-boiler) and whisk until the yolks become pale yellow in color. Continue to whisk over low to medium heat until the mixture begins to thicken, about 10 minutes. Add the juices and zests and continue to whisk so the sauce thickens back up again. Add the liqueur and whisk until incorporated and the sabayon is light, fluffy and has good volume, 2 minutes longer. Assemble the raspberries and puff pastry together on a plate (if serving individual plates, allow 2 puffs per plate). Drizzle with the honey and pour the sabayon over and around the raspberries and puff pastry squares. Dust with the confectioners' sugar.",95,40,135,http:////food.fnr.sndimg.com/content/dam/images/food/fullset/2012/2/13/0/GI1107H_puff-pastries-with-raspberries-and-orange-sabayon_s4x3.jpg.rend.hgtvcom.476.357.suffix/1371603128065.jpeg,https://www.foodnetwork.com/recipes/guy-fieri/puff-pastries-with-raspberries-and-orange-sabayon-recipe-2124781
141, Chicken and Summer Vegetable Stew with Couscous Chicken and Summer Vegetable Stew with Couscous ,"Deselect All Chicken Stew: 3 cloves garlic, smashed 2 large rainbow carrots, peeled and cut into 1-inch chunks 1 medium yellow onion, cut into 6 wedges, root end kept intact 1 cinnamon stick, snapped in half 1/3 cup golden raisins 1 tablespoon chopped peeled fresh ginger 1 1/2 teaspoons ground cumin 1 1/2 teaspoons paprika 1 teaspoon sugar 1 teaspoon ground turmeric Kosher salt and freshly ground black pepper 1 pound boneless skinless chicken thighs, cut into bite-size pieces One 15 1/2-ounce can chickpeas, rinsed and drained 12 ounces assorted color cherry tomatoes 1 large zucchini, quartered lengthwise and cut into 1-inch chunks Couscous: 1 tablespoon unsalted butter 1 teaspoon kosher salt 1 1/2 cups couscous Topping: 1/2 cup cilantro leaves, roughly chopped 1/2 cup parsley leaves, roughly chopped 1/4 cup sliced almonds 1/4 cup salted shelled pistachios, crushed 1/4 cup golden raisins Harissa and plain yogurt, for serving","For the chicken stew: Put the garlic, carrots, onion, cinnamon, raisins, ginger, cumin, paprika, sugar, turmeric, 1 tablespoon salt and several grinds of black pepper in a large saucepan or Dutch oven with a tight-fitting lid. Add 2 cups water and bring to a boil over high heat; cover, reduce the heat and simmer until the carrots start to get tender, about 15 minutes. Add the chicken, chickpeas, tomatoes and zucchini and stir to combine. Return to a boil over high heat, cover, reduce the heat and simmer until the stew is slightly thickened and fragrant and the vegetables are tender enough to cut with the side of a fork, but still hold their shapes, about 15 minutes. (If the vegetables are fork-tender a bit sooner, remove them to a bowl while the liquid reduces then return them to the pot when ready to serve.) Remove and discard the cinnamon sticks. For the couscous: Bring 1 1/2 cups water to a boil with the butter and salt in a small saucepan. Stir in the couscous, remove from the heat, cover and set aside until the water has been absorbed and the couscous is plump, about 5 minutes. Fluff with a fork and keep warm. For the topping: Combine the cilantro, parsley, almonds, pistachios and raisins in a medium bowl. To serve, divide the couscous among bowls, top with the stew and sprinkle with the herb topping. Serve with harissa and yogurt on the side.",16,28,44,http:////food.fnr.sndimg.com/content/dam/images/food/fullset/2022/06/29/$RBF5U51.jpg.rend.hgtvcom.476.357.suffix/1656600749846.jpeg,https://www.foodnetwork.com/recipes/food-network-kitchen/chicken-and-summer-vegetable-stew-with-couscous-12849029
142, Spicy Couscous and Vegetables Spicy Couscous and Vegetables ,"Deselect All 1 small zucchini, halved and cut into slices 2 small red peppers, large dice 1 small eggplant, quartered and sliced Olive oil, to taste Salt and freshly ground black pepper 1 1/2 cups couscous 2 cups vegetable stock 1/2 teaspoon sea salt 1/2 teaspoon ground roasted cumin seeds 1/2 teaspoon ground ginger 1/2 teaspoon paprika 1/4 cup orange juice 1 tablespoon roughly chopped parsley 2 tablespoons roughly chopped cilantro 2 tablespoons olive oil 1/2 lemon, grated zest and juice","Preheat oven to 375 degrees F. Place cut vegetables on a baking sheet and drizzle with some olive oil and season with salt and pepper to taste. Place in oven and roast for about 10 minutes. Place couscous in a heat proof bowl and stir in all the spices and orange juice. Bring the vegetable stock to a boil and pour over the couscous making sure it covers the couscous mixture completely. Cover with a plate or plastic wrap and leave for 5 to 10 minutes or until all the stock is absorbed. Stir in the herbs, olive oil, grated lemon zest and juice. Fluff the couscous with a fork and toss with roasted vegetables.",110,73,183,http:////food.fnr.sndimg.com/content/dam/images/food/fullset/2008/4/23/0/RB0106_Spicy-Couscous-and-Vegetables.jpg.rend.hgtvcom.476.357.suffix/1371585593880.jpeg,https://www.foodnetwork.com/recipes/danny-boome/spicy-couscous-and-vegetables-recipe-1939012
143, Kofta Kabobs Kofta Kabobs ,"Deselect All 2 pounds lean ground lamb or beef 4 stems parsley 1 small onion, finely chopped 3 cloves garlic, roasted, peeled, and chopped 1 teaspoon white pepper 1 teaspoon ground cumin 1/2 teaspoon ground coriander, optional Small pinch clove, optional 5 mint leaves, very finely chopped, optional Kosher salt Chile flakes, optional","In a large bowl, put the ground meat, flattened in the bowl, add all the ingredients. Knead for at least 5 minutes until all is well mixed. Let the kofta rest for 20 to 30 minutes in a cool place to marinate. Wet your hand with water. Take the kofta and make a big cigar. Put on a long skewer, in the center. Repeat skewering until done. Cook over a charcoal grill. Serve hot.",48,88,136,,https://www.foodnetwork.com/recipes/kofta-kabobs-recipe-1939389
144," Fish Baked with Olives, Parsley and Garlic: Tagine Fish Baked with Olives, Parsley and Garlic: Tagine ","Deselect All 1/4 cup extra-virgin olive oil 1 medium-sized yellow onion, very finely chopped (about 1/2 cup) 3 cloves garlic, minced 1 cup finely chopped fresh parsley leaves Freshly ground black pepper 4 flounder or sole fillets, each weighing about 6 ounces 1/2 pound (drained weight) pitted Middle Eastern green olives, coarsely chopped 1 lemon, very thinly sliced Paprika, to taste Couscous, cooking according to package directions, for serving","Preheat the oven to 400 degrees F. Use a small amount of olive oil to grease a shallow baking dish that is just large enough to hold the stuffed fillets in 1 layer, and set aside. Heat 1 tablespoon of the remaining olive oil in a medium-size skillet over medium heat. When it is hot, add the onion and garlic, and cook, stirring, just until the onion is softened, 3 to 5 minutes. Remove from the heat and stir in the parsley and pepper, and set aside. Rinse the fillets and pat dry with paper towels. Lay the fillets out flat on a work surface, inside up. Spread the onion mixture down the center of each fillet, dividing evenly. Fold fillet over the onion mixture, and secure with a couple of toothpicks. Arrange the stuffed fillets in the prepared baking dish. Spoon the chopped olives evenly over the fillets. Arrange the lemon slices over the olives. Drizzle evenly with the remaining olive oil, then sprinkle lightly with paprika. Cover the baking dish very tightly with aluminum foil, and bake for 20 minutes. Remove the foil, and test the fish for doneness. It should flake when lightly touched with a fork. Serve immediately, accompanied by hot couscous.",61,38,99,,https://www.foodnetwork.com/recipes/fish-baked-with-olives-parsley-and-garlic-tagine-recipe-1943143
145, Chickpea Pancake Chickpea Pancake ,,"Blend 1 1/2 cups water, 1 cup chickpea flour, 2 tablespoons olive oil and 3/4 teaspoon kosher salt in a blender. Let rest 15 minutes, then skim off the foam. Heat 2 tablespoons olive oil in a medium ovenproof nonstick skillet over high heat. Pour in the batter and cook until the bottom is set, 2 minutes. Sprinkle with sesame seeds and crushed coriander and cumin seeds. Bake at 425 degrees F until the pancake springs back when pressed, 20 minutes. Sprinkle with flaky salt.",22,35,57,http:////food.fnr.sndimg.com/content/dam/images/food/fullset/2018/2/7/0/FNM_030118-Chickpea-Pancake_s4x3.jpg.rend.hgtvcom.476.357.suffix/1518020342465.jpeg,https://www.foodnetwork.com/recipes/food-network-kitchen/chickpea-pancake-4665135
146, Middle Eastern Lemonade Middle Eastern Lemonade ,"Deselect All 3/4 cup superfine sugar 1/4 cup packed fresh mint leaves 1 cup fresh lemon juice (6 to 8 lemons) 2 teaspoons orange flower water  1/2 orange, thinly sliced Lemon vodka, for serving, optional","Muddle the sugar and mint in the bottom of a pitcher. Stir in the lemon juice, 4 cups cold water and the orange flower water until the sugar is dissolved. Add the orange slices, cover and refrigerate until very cold, about 2 hours. Serve over ice. For a cocktail version, add a shot of lemon vodka to each glass.",110,95,205,http:////food.fnr.sndimg.com/content/dam/images/food/fullset/2013/8/7/0/QF0309H_middle-eastern-lemonade-recipe_s4x3.jpg.rend.hgtvcom.476.357.suffix/1377803651913.jpeg,https://www.foodnetwork.com/recipes/middle-eastern-lemonade-2141387
147," Lamb, Olive and Caramelised Onion Tagine Lamb, Olive and Caramelised Onion Tagine ","Deselect All 2 1/4 pounds diced leg of lamb 1 head garlic, separated into cloves 12 ounces pitted black olives in brine, 5 ounces drained weight to give 1 1/4 cups 1/2 cup caramelized onions from a jar 4 tablespoons capers 2 teaspoons ground cumin 2 teaspoons ground ginger 1 bottle red wine","Preheat the oven to 150C/300 degrees F. Put all of the ingredients into a casserole or heavy based pan, pouring in the wine last and giving everything a good stir. Bring the pan to a boil, then clamp on the lid and put into the oven for 2 hours or until the lamb is very tender.",105,91,196,http:////food.fnr.sndimg.com/content/dam/images/food/fullset/2007/12/7/0/NL0207_Lamb_Onion_Carmelised_Onion.jpg.rend.hgtvcom.476.357.suffix/1371585981525.jpeg,https://www.foodnetwork.com/recipes/nigella-lawson/lamb-olive-and-caramelised-onion-tagine-recipe-1950530
148, Grilled Chicken Tagine with Dried Apricots and Almonds Grilled Chicken Tagine with Dried Apricots and Almonds ,"Deselect All 1 1/2 pounds skinless, boneless chicken thighs, cut into 2- to 3-inch chunks 3 medium carrots, cut into large pieces 1 large red onion, cut into 1/2-inch-thick wedges with the root end intact 2 cloves garlic, thinly sliced 1 1/2 teaspoons ground turmeric 1 1/4 teaspoons ground ginger 3/4 teaspoon ground cinnamon Kosher salt and freshly ground pepper 1 14.5-ounce can diced fire-roasted tomatoes 1/2 cup low-sodium chicken broth 2 tablespoons extra-virgin olive oil 1/2 cup halved dried apricots 1/4 cup slivered almonds, toasted Cooked couscous, for serving Fresh cilantro, for topping","Preheat a grill to medium. Combine the chicken, carrots, red onion, garlic, turmeric, ginger, cinnamon and 1 teaspoon each salt and pepper in a large bowl and toss to coat. Stir in the tomatoes and their juices, the chicken broth, olive oil, apricots and almonds. Tear off four 18-inch-long sheets of heavy-duty foil. Divide the chicken mixture evenly among the sheets. Bring the short ends of the foil together and fold over twice to seal, then fold in the sides to seal the packets, leaving room for heat to circulate. Grill the foil packets, flipping once, until the chicken is cooked through, 20 to 24 minutes. Remove from the grill and let stand 5 minutes. Carefully open the packets and add some cooked couscous to each. Top with cilantro.",90,109,199,http:////food.fnr.sndimg.com/content/dam/images/food/fullset/2023/4/13/FNM_050123_Grilled-Chicken-Tagine-With-Dried-Apricots_s4x3.jpg.rend.hgtvcom.476.357.suffix/1681396109865.jpeg,https://www.foodnetwork.com/recipes/food-network-kitchen/grilled-chicken-tagine-with-dried-apricots-and-almonds-14194458
149, Chicken and Date Pastilla Chicken and Date Pastilla ,"Deselect All Cooking spray 1 tablespoon olive oil 1 cup onion, thinly sliced 2 teaspoons grated fresh ginger 1 teaspoon ground cumin 1 teaspoon ground coriander 1/4 teaspoon ground cinnamon 1/2 teaspoon salt 1/4 teaspoon freshly ground black pepper 2 cups diced cooked chicken, about 2 breast halves 1/2 cup sliced pimento-stuffed olives 1/2 cup chopped dates 4 eggs, lightly beaten 1/2 cup reduced-sodium chicken broth 8 sheets phyllo dough 1/4 cup sliced or slivered almonds Confectioners' sugar","Preheat oven to 425 degrees F. Coat a 9-inch pie plate with cooking spray. Heat oil in a large skillet over medium-high heat. Add onion and ginger and cook 3 minutes, or until soft. Add cumin, coriander, cinnamon, salt, and black pepper and cook 1 minute, until spices are fragrant. Add chicken, olives and dates and cook 1 minute to heat through. Remove from heat. In a medium bowl, whisk together eggs and broth. Add to chicken mixture. Arrange 1 sheet of phyllo in the bottom of pie plate, allowing dough to hang over the edges. Spray with cooking spray and then top with another sheet of phyllo dough. Top with 1/3 of chicken mixture. Fold overhanging dough over chicken filling. Continue layering, using all sheets, 2 at a time, ending with phyllo dough, fold top sheets over, to cover the filling so nothing is hanging over the sides. Spray the surface with cooking spray and top with almonds. Bake 15 minutes, until golden brown. Sift confectioners' sugar over top just before serving. Note: Keep phyllo sheets moist in between use so they do not dry out. Cover them with a damp towel or cloth.",39,48,87,http:////food.fnr.sndimg.com/content/dam/images/food/fullset/2008/3/5/0/RM0602_Chicken-and-Date-Pastilla-Pie.jpg.rend.hgtvcom.476.357.suffix/1371585941564.jpeg,https://www.foodnetwork.com/recipes/chicken-and-date-pastilla-recipe-1938101
150, Tomato Couscous Salad Tomato Couscous Salad ,"Deselect All 1 1/4 cups vegetable broth 1 cup tomato couscous 1/2 pound thin asparagus spears, cut into 1-inch pieces 2 scallions, sliced 3 tablespoons Italian salad dressing, divided 1 cup halved cherry tomatoes 1/4 cup finely chopped fresh basil leaves","Preheat oven to 400 degrees F. Lightly spray baking sheet with olive oil cooking spray; set aside. In a small pot, bring the broth to a boil. Stir in couscous. Remove from heat and cover. Let stand 5 minutes. Fluff with fork; set aside. Place asparagus and scallions on prepared baking sheet. Toss with 1 tablespoon salad dressing. Roast in preheated oven for 10 to 12 minutes. In a large bowl, combine cooked couscous, roasted vegetables, cherry tomatoes, basil, and remaining salad dressing. Toss to combine. Serve warm or at room temperature.",19,28,47,http:////food.fnr.sndimg.com/content/dam/images/food/fullset/2008/4/13/0/SH1103_Tomato-Couscous-Salad.jpg.rend.hgtvcom.476.357.suffix/1371585643539.jpeg,https://www.foodnetwork.com/recipes/tomato-couscous-salad-recipe-1938414
151, Couscous Couscous ,Deselect All 1 1/2 to 2 cups couscous 1 1/2 to 2 cups chicken stock or water 3 tablespoons butter Salt and freshly cracked black pepper,"Place the couscous in a glass or ceramic mixing bowl. In a medium saucepan, bring the chicken stock or water and butter to a boil. Pour over the couscous and cover the mixing bowl with plastic wrap or aluminum foil. Set aside and let stand 5 minutes. Fluff with a fork, then add the butter and salt and pepper, to taste, and set aside while butter melts. Serve hot with Moroccan Chicken, if desired.",82,8,90,,https://www.foodnetwork.com/recipes/couscous-recipe1-1950267
152, Beef Tagine Beef Tagine ,"Deselect All 1 level tablespoon ras el hanout spice mix* 1 level tablespoon ground cumin 1 level tablespoon ground cinnamon 1 level tablespoon ground ginger 1 level tablespoon sweet paprika Sea salt and freshly ground black pepper 1 1/3 pounds/600 g stewing beef  Olive oil 1 onion, peeled and finely chopped A small bunch of fresh coriander (cilantro), leaves picked and stalks reserved  1 (14-ounce/400 g) tin (can) chickpeas, drained 1 (14-ounce/400 g) tin (can) chopped tomatoes 3 1/2 cups/800 ml vegetable stock, preferably organic 1 small squash (approximately 1 3/4 pounds/800 g), deseeded and cut into 2-inch/5 cm chunks  3 1/2 ounces/100 g prunes, stoned and roughly torn 2 tablespoons flaked almonds, toasted","Serving suggestion: Lightly seasoned couscous. To make the spice rub: Mix the ras el hanout, cumin, cinnamon, ginger, paprika, salt, and black pepper together in a small bowl. Put the beef into a large bowl, massage it with the spice rub, then cover with plastic wrap or clingfilm and put into the refrigerator for a couple of hours-ideally overnight. That way the spices really penetrate and flavour the meat. When you're ready to cook, heat a generous lug of olive oil in a tagine or casserole-type pan and fry the meat over a medium heat for 5 minutes. Add the chopped onion and coriander (cilantro) stalks and fry for another 5 minutes. Tip in the chickpeas and tomatoes, then pour in 1 3/4 cups/400 ml stock and stir. Bring to the boil, then put the lid on the pan or cover with foil and reduce to a simmer for 1 1/2 hours. At this point add your squash, the prunes and the rest of the stock. Give everything a gentle stir, then pop the lid back on the pan and continue cooking for another 1 1/2 hours. Keep an eye on it and add a splash of water if it looks too dry. Once the time is up, take the lid off and check the consistency. If it seems a bit too runny, simmer for 5 to 10 minutes more with the lid off. The beef should be really tender and flaking apart now, so have a taste and season with a pinch or 2 of salt. Scatter the coriander (cilantro) leaves over the tagine along with the toasted almonds, then take it straight to the table with a big bowl of lightly seasoned couscous and dive in.",61,81,142,,https://www.foodnetwork.com/recipes/jamie-oliver/beef-tagine-2124477
153, Lamb Tagine with Chickpeas Lamb Tagine with Chickpeas ,"Deselect All 2 tablespoons unsalted butter 3 pounds boneless lamb stew meat, cut into 1-inch cubes 2 cups chopped onions 1/2 cup chopped scallions 1 (19-ounce) can chickpeas, drained and lightly rinsed 1 cup water 1 tablespoon minced garlic 1 teaspoon ground ginger 3/4 teaspoon salt 1/2 teaspoon ground black pepper 1/2 teaspoon ground cinnamon 1/8 to 1/4 teaspoon ground red pepper 1/2 cup chopped fresh parsley Salt and ground pepper, to taste","Heat butter in a large heavy lidded pan over medium-high heat until fragrant and golden. Add lamb in 2 batches and brown. Remove to a plate and set aside. Add onions and scallions and cook, stirring often until tender, 5 to 7 minutes. Stir in drained chickpeas, water, garlic, ginger, salt, black pepper, cinnamon and red pepper. Return the lamb and all accumulated juices to the pan. Gently stir to coat. Bring the mixture to a boil, then reduce the heat so the liquid just simmers. Cover tightly and cook, stirring the lamb once or twice, for 35 to 45 minutes. Remove from heat and stir in parsley and salt and pepper to taste.",113,82,195,,https://www.foodnetwork.com/recipes/lamb-tagine-with-chickpeas-recipe-1907321
154, Chicken Tagine with Olives and Preserved Lemons Chicken Tagine with Olives and Preserved Lemons ,"Deselect All Rock salt 1 whole large chicken, cut into 8 pieces 1 tablespoon white wine vinegar 5 tablespoons olive oil 1 large bunch fresh cilantro, chopped 1 teaspoon cinnamon 1/2 teaspoon real saffron Pinch fine salt 1/2 pound onions, chopped 5 cloves garlic, chopped 1 teaspoon cumin 1 teaspoon ground ginger 1 teaspoon paprika 1 teaspoon turmeric 1/4 pound gizzards, optional 1/4 pound chicken liver, optional 1/4 cup mixed olives, pitted 3 small preserved lemons","First rub the rock salt into the chicken pieces and then wash the chicken in the white wine vinegar and water. Leave for 10 minutes. Rinse and dry and place onto a clean plate. In a large bowl, mix the olive oil, coriander, cinnamon, saffron, fine salt, 1/2 the onions, garlic, cumin, ginger, paprika, turmeric. Mix all these ingredients into the oil and crush the garlic and add a little water to make a paste. Roll the chicken pieces into the marinade and leave for 10 to 15 minutes. For cooking, use a tagine (traditional Moroccan dish) or a deep, heavy bottom casserole dish. Heat the dish up and add 2 tablespoons of olive oil to the hot dish. Drop in the chicken and pour over the excess marinade juices. Add the remaining onions, gizzards, chicken livers, olives, and chopped preserved lemons (no pulp). Cook in medium hot oven (350 degrees F) for 45 minutes. Serve with fresh bread.",11,62,73,,https://www.foodnetwork.com/recipes/chicken-tagine-with-olives-and-preserved-lemons-recipe-1938959
